{
  "version": 1,
  "ignore_paths": [
    "scripts/video_editing/deprecated/**",
    "helper_scripts/utils/update_manager/**",
    "helper_scripts/utils/logger/import_log_example.py",
    "scripts/script_manager/**"
  ],
  "discover_roots": ["scripts", "helper_scripts"],
  "sinks": {
    "artifact": "scripts.script_manager.sinks.artifact",
    "dashboard": "scripts.script_manager.sinks.dashboard",
    "property_portal": "scripts.script_manager.sinks.property_portal",
    "callback": "scripts.script_manager.sinks.callback",
    "email": "scripts.script_manager.sinks.email"
  },
  "scripts": [
    {
      "name": "leadgen",
      "description": "Local business lead generation (Google Places API or Playwright Maps)",
      "status": "active",
      "entry": {"type": "path", "path": "scripts/lead_automation/leadgen.py"},
      "cwd": "scripts/lead_automation",
      "interactive": true,
      "non_interactive_args": ["--defaults"],
      "help_supported": true,
      "env": {
        "required": [],
        "optional": ["GOOGLE_API_KEY", "APIFY_API_KEY", "MVLLC_LOGS_KEY", "CRM_MCP_VENTURE"],
        "conditional": [
          {"when_args_any": ["--output=dashboard", "--output=both"], "require": ["CRM_MCP_MV_LLC"]},
          {"when_args_any": ["--leadgen-type=api_manager"], "require": ["GOOGLE_API_KEY"]}
        ]
      },
      "needs_playwright": "conditional",
      "playwright_when_args_any": ["--leadgen-type=playwright"],
      "timeout_seconds": 14400,
      "outputs": ["scripts/lead_automation/*leads_output*.json", "logs/**"],
      "side_effects": ["external_api", "external_post"],
      "stateful_files": [
        "scripts/lead_automation/leadgen_search_history.json",
        "scripts/lead_automation/leadgen_settings.json"
      ],
      "ci_allowed": true,
      "tags": ["leads"],
      "docs": "documentation/scripts/leadgen.md",
      "menu": "leadgen"
    },
    {
      "name": "leadenrich",
      "ci_allowed": true,
      "description": "Facebook email enrichment for leads via Apify",
      "status": "active",
      "entry": {"type": "path", "path": "scripts/lead_automation/leadenrich.py"},
      "cwd": "scripts/lead_automation",
      "help_supported": true,
      "env": {
        "required": ["APIFY_API_KEY"],
        "optional": ["MVLLC_LOGS_KEY", "CRM_MCP_VENTURE"],
        "conditional": [
          {"when_args_any": ["--dashboard"], "require": ["CRM_MCP_MV_LLC"]}
        ]
      },
      "needs_playwright": false,
      "outputs": ["scripts/lead_automation/*leads_output*.json", "logs/**"],
      "side_effects": ["external_api", "external_post"],
      "tags": ["leads"],
      "docs": "documentation/scripts/leadenrich.md",
      "menu": "flags",
      "prompts": [
        {"arg": "--json-path", "prompt": "Leads JSON path", "kind": "str"},
        {"arg": "--output-path", "prompt": "Output JSON path", "kind": "str"},
        {"arg": "--limit", "prompt": "Max leads (0 = no limit)", "kind": "int"},
        {"arg": "--min-similarity", "prompt": "Minimum name similarity", "kind": "float"},
        {"arg": "--max-search-results", "prompt": "Facebook results per lead", "kind": "int"},
        {"arg": "--max-workers", "prompt": "Concurrent searches", "kind": "int"},
        {"arg": "--retry-all", "prompt": "Re-attempt leads already checked?", "kind": "bool"},
        {"arg": "--dry-run", "prompt": "Dry run?", "kind": "bool"},
        {"arg": "--dashboard", "prompt": "Upload enriched leads to the dashboard?", "kind": "bool"}
      ]
    },
    {
      "name": "leadenrich-playwright",
      "ci_allowed": true,
      "description": "Google and website enrichment for leads using Playwright",
      "status": "active",
      "entry": {"type": "path", "path": "scripts/lead_automation/leadenrich_playwright.py"},
      "cwd": "scripts/lead_automation",
      "help_supported": true,
      "env": {
        "required": [],
        "optional": ["MVLLC_LOGS_KEY", "CRM_MCP_VENTURE"],
        "conditional": [
          {"when_args_any": ["--dashboard"], "require": ["CRM_MCP_MV_LLC"]},
          {"when_args_any": ["--from-crm"], "require": ["LEAD_INGEST_KEY"]}
        ]
      },
      "needs_playwright": true,
      "outputs": ["scripts/lead_automation/*leads_output*.json", "logs/**"],
      "side_effects": ["external_api", "external_post"],
      "tags": ["leads"],
      "docs": "documentation/scripts/leadenrich_playwright.md",
      "menu": "flags",
      "prompts": [
        {"arg": "--json-path", "prompt": "Leads JSON path", "kind": "str"},
        {"arg": "--output-path", "prompt": "Output JSON path", "kind": "str"},
        {"arg": "--limit", "prompt": "Max leads (0 = no limit)", "kind": "int"},
        {"arg": "--from-crm", "prompt": "Pull leads from the CRM instead of a JSON file?", "kind": "bool"},
        {"arg": "--dashboard", "prompt": "Upload enriched leads to the dashboard?", "kind": "bool"},
        {"arg": "--dry-run", "prompt": "Dry run?", "kind": "bool"},
        {"arg": "--retry-all", "prompt": "Re-attempt leads already researched?", "kind": "bool"},
        {"arg": "--max-queries", "prompt": "Google searches per lead", "kind": "int"},
        {"arg": "--status", "prompt": "CRM status filter (repeat by entering one at a time in extra args)", "kind": "str"},
        {"arg": "--category", "prompt": "CRM category filter", "kind": "str"},
        {"arg": "--search", "prompt": "CRM text search", "kind": "str"},
        {"arg": "--since", "prompt": "CRM created-since date (YYYY-MM-DD)", "kind": "str"},
        {"arg": "--min-score", "prompt": "CRM minimum score", "kind": "int"},
        {"arg": "--max-score", "prompt": "CRM maximum score", "kind": "int"}
      ]
    },
    {
      "name": "lead-ingest",
      "description": "Upload leads_output.csv to the CRM",
      "status": "broken",
      "status_reason": "from helper_scripts.utils.logger import setup_logger fails (no __init__.py in helper_scripts/utils/logger)",
      "entry": {"type": "path", "path": "scripts/lead_automation/lead_automation.py"},
      "cwd": "scripts/lead_automation",
      "help_supported": true,
      "env": {
        "required": ["CRM_MCP_MV_LLC"],
        "optional": ["CRM_MCP_VENTURE", "MVLLC_LOGS_KEY"]
      },
      "needs_playwright": false,
      "outputs": ["logs/**"],
      "side_effects": ["external_post"],
      "tags": ["leads"],
      "docs": "documentation/scripts/lead_automation.md"
    },
    {
      "name": "stock-analyzer",
      "description": "Daily stock data and Perplexity analysis to the dashboard",
      "status": "active",
      "entry": {"type": "path", "path": "scripts/stock_analyzer/stock_analyzer.py"},
      "cwd": ".",
      "help_supported": false,
      "env": {
        "required": ["STOCK_INGEST_TOKEN", "APIFY_API_KEY", "PERPLEXITY_API_KEY"],
        "optional": ["MVLLC_LOGS_KEY"]
      },
      "needs_playwright": false,
      "timeout_seconds": 1800,
      "outputs": ["logs/**"],
      "side_effects": ["external_api", "external_post"],
      "stateful_files": ["scripts/stock_analyzer/previous_run_date.txt"],
      "ci_allowed": true,
      "schedule": {
        "cron": "0 14 * * 1-5",
        "tz": "UTC",
        "confirm": true,
        "note": "weekdays 14:00 UTC via script_manager_schedule.yml"
      },
      "tags": ["stocks", "scheduled"],
      "docs": "documentation/scripts/stock_analyzer.md",
      "menu": "confirm"
    },
    {
      "name": "blog-automation",
      "description": "Generate the next Chikara Realms blog post from topic files",
      "status": "broken",
      "status_reason": "from helper_scripts.utils.logger import setup_logger fails (no __init__.py in helper_scripts/utils/logger)",
      "entry": {"type": "path", "path": "scripts/chikara_realms/blog_automation.py"},
      "cwd": "scripts/chikara_realms",
      "env": {
        "required": ["CHATGPT_API_KEY", "PERPLEXITY_API_KEY", "CHIKARA_REALMS_SECRET"],
        "optional": ["MVLLC_LOGS_KEY"]
      },
      "needs_playwright": false,
      "outputs": ["logs/**"],
      "side_effects": ["external_api", "writes_repo_files"],
      "stateful_files": ["scripts/chikara_realms/*_topics.json"],
      "tags": ["content"],
      "docs": "documentation/scripts/blog_automation.md"
    },
    {
      "name": "property-listing-gen",
      "ci_allowed": true,
      "description": "Collect Zillow listing URLs for ZIP codes via Apify",
      "status": "active",
      "entry": {"type": "path", "path": "scripts/zillow_automation/property_listing_gen.py"},
      "cwd": "scripts/zillow_automation",
      "help_supported": true,
      "env": {
        "required": ["APIFY_API_KEY"],
        "optional": ["MVLLC_LOGS_KEY"]
      },
      "needs_playwright": false,
      "outputs": ["scripts/zillow_automation/property_urls.json", "logs/**"],
      "side_effects": ["external_api"],
      "tags": ["listings"],
      "docs": "documentation/scripts/property_listing_gen.md",
      "menu": "flags",
      "prompts": [
        {"arg": "--input", "prompt": "Actor input JSON", "kind": "str"},
        {"arg": "--output-path", "prompt": "Output JSON path", "kind": "str"},
        {"arg": "--zip-codes", "prompt": "ZIP codes", "kind": "str", "split": true},
        {"arg": "--price-min", "prompt": "Minimum price", "kind": "int"},
        {"arg": "--price-max", "prompt": "Maximum price", "kind": "int"},
        {"arg": "--days-on-zillow", "prompt": "Max days on Zillow", "kind": "str"},
        {"arg": "--results-limit", "prompt": "Max properties per ZIP", "kind": "int"},
        {"arg": "--for-sale-by-agent", "prompt": "Include agent listings?", "kind": "bool"},
        {"arg": "--no-for-sale-by-agent", "prompt": "Exclude agent listings?", "kind": "bool"},
        {"arg": "--for-sale-by-owner", "prompt": "Include owner listings?", "kind": "bool"},
        {"arg": "--no-for-sale-by-owner", "prompt": "Exclude owner listings?", "kind": "bool"},
        {"arg": "--for-rent", "prompt": "Include rentals?", "kind": "bool"},